,source_text,target_text,source_lang,target_lang,source_text_ner,target_text_ner,source_text_ner_tokens,target_text_ner_tokens
6570,Who is the youngest author of a best-selling book?,ベストセラーとなった本の著者で一番若いのは？,en,ja,"['O', 'O', 'O', 'O', 'O', 'O', 'O', 'O', 'O', 'O', 'O', 'O']","['O', 'O']","['Who', 'is', 'the', 'youngest', 'author', 'of', 'a', 'best', '-', 'selling', 'book', '?']","['ベストセラーとなった本の著者で一番若いのは', '？']"
6435,Which Grammy Award was Post Malone nominated for but did not win in 2020?,2020年のグラミー賞でポスト・マローンがノミネートされたものの受賞できなかった賞は何？,en,ja,"['O', 'B-WORK_OF_ART', 'I-WORK_OF_ART', 'O', 'B-PERSON', 'I-PERSON', 'O', 'O', 'O', 'O', 'O', 'O', 'O', 'B-DATE', 'O']","['B-DATE', 'I-DATE', 'O', 'O', 'O']","['Which', 'Grammy', 'Award', 'was', 'Post', 'Malone', 'nominated', 'for', 'but', 'did', 'not', 'win', 'in', '2020', '?']","['2020', '年のグラミー賞でポスト', '・', 'マローンがノミネートされたものの受賞できなかった賞は何', '？']"
960,Which World Series did the Rays play in but not win?,Raysさんはどのワールドシリーズにプレーしたが勝ってなかったですか？,en,ja,"['O', 'B-EVENT', 'I-EVENT', 'O', 'O', 'B-ORG', 'O', 'O', 'O', 'O', 'O', 'O']","['O', 'O']","['Which', 'World', 'Series', 'did', 'the', 'Rays', 'play', 'in', 'but', 'not', 'win', '?']","['Raysさんはどのワールドシリーズにプレーしたが勝ってなかったですか', '？']"
561,How many singers has AC/DC had?,ACDCには何人のシンガーがいますか？,en,ja,"['O', 'O', 'O', 'O', 'B-ORG', 'I-ORG', 'I-ORG', 'O', 'O']","['B-ORG', 'O']","['How', 'many', 'singers', 'has', 'AC', '/', 'DC', 'had', '?']","['ACDCには何人のシンガーがいますか', '？']"
4280,Which European football club won the UEFA Champions League and placed 4th in the Premier League in 2021?,2021年にUEFAチャンピオンリーグで優勝し、プレミアリーグで4位になったヨーロッパのサッカーチームは？,en,ja,"['O', 'B-NORP', 'O', 'O', 'O', 'B-EVENT', 'I-EVENT', 'I-EVENT', 'I-EVENT', 'O', 'O', 'B-ORDINAL', 'O', 'B-ORG', 'I-ORG', 'I-ORG', 'O', 'B-DATE', 'O']","['B-DATE', 'I-DATE', 'O', 'O', 'O']","['Which', 'European', 'football', 'club', 'won', 'the', 'UEFA', 'Champions', 'League', 'and', 'placed', '4th', 'in', 'the', 'Premier', 'League', 'in', '2021', '?']","['2021', '年にUEFAチャンピオンリーグで優勝し', '、', 'プレミアリーグで4位になったヨーロッパのサッカーチームは', '？']"
6359,How many Avengers movies has Spider-Man appeared in?,映画アベンジャーズにスパイダーマンが出てくるのは何作ありますか？,en,ja,"['O', 'O', 'B-WORK_OF_ART', 'O', 'O', 'B-PERSON', 'I-PERSON', 'I-PERSON', 'O', 'O', 'O']","['O', 'O']","['How', 'many', 'Avengers', 'movies', 'has', 'Spider', '-', 'Man', 'appeared', 'in', '?']","['映画アベンジャーズにスパイダーマンが出てくるのは何作ありますか', '？']"
3862,Was Joseph Stalin the leader of Germany?,ヨシフ・スターリンはドイツの指導者でしたか？,en,ja,"['O', 'B-PERSON', 'I-PERSON', 'O', 'O', 'O', 'B-GPE', 'O']","['B-PERSON', 'I-PERSON', 'I-PERSON', 'O']","['Was', 'Joseph', 'Stalin', 'the', 'leader', 'of', 'Germany', '?']","['ヨシフ', '・', 'スターリンはドイツの指導者でしたか', '？']"
957,Which MLB teams have not won a World Series?,MLBのどのチームはまだワールドシリーズを勝ったことがないですか？,en,ja,"['O', 'B-ORG', 'O', 'O', 'O', 'O', 'B-EVENT', 'I-EVENT', 'I-EVENT', 'O']","['O', 'O']","['Which', 'MLB', 'teams', 'have', 'not', 'won', 'a', 'World', 'Series', '?']","['MLBのどのチームはまだワールドシリーズを勝ったことがないですか', '？']"
334,Who directed Tom's Cruise's third Mission: Impossible?,トム・クルーズの『ミッション・インポッシブル3』で 監督を務めたのは誰？,en,ja,"['O', 'O', 'B-PERSON', 'I-PERSON', 'B-ORDINAL', 'B-WORK_OF_ART', 'I-WORK_OF_ART', 'I-WORK_OF_ART']","['B-PERSON', 'I-PERSON', 'I-PERSON', 'O', 'B-WORK_OF_ART', 'I-WORK_OF_ART', 'I-WORK_OF_ART', 'I-WORK_OF_ART', 'O', 'O', 'O']","['Who', 'directed', ""Tom's"", ""Cruise's"", 'third', 'Mission:', 'Impossible', '?']","['トム', '・', 'クルーズの', '『', 'ミッション', '・', 'インポッシブル3', '』', 'で', '監督を務めたのは誰', '？']"
2178,What is the population of the U.S. state where Los Angeles is located?,ロサンゼルスがあるアメリカの州の人口はどのくらいですか？,en,ja,"['O', 'O', 'O', 'O', 'O', 'O', 'B-GPE', 'O', 'O', 'B-GPE', 'I-GPE', 'O', 'O', 'O']","['O', 'O']","['What', 'is', 'the', 'population', 'of', 'the', 'U.S.', 'state', 'where', 'Los', 'Angeles', 'is', 'located', '?']","['ロサンゼルスがあるアメリカの州の人口はどのくらいですか', '？']"
5339,What year did Louis Armstrong and his Hot Five from?,ルイ・アームストロングの「ホット・ファイブ」は何年からですか？,en,ja,"['O', 'O', 'O', 'B-PERSON', 'I-PERSON', 'O', 'O', 'B-ORG', 'O', 'O', 'O']","['B-PERSON', 'I-PERSON', 'I-PERSON', 'O', 'B-WORK_OF_ART', 'I-WORK_OF_ART', 'I-WORK_OF_ART', 'O', 'O', 'O']","['What', 'year', 'did', 'Louis', 'Armstrong', 'and', 'his', 'Hot', 'Five', 'from', '?']","['ルイ', '・', 'アームストロングの', '「', 'ホット', '・', 'ファイブ', '」', 'は何年からですか', '？']"
4527,Which country has more population Brazil or Mexico?,ブラジルとメキシコではどちらの国が人口が多いですか？,en,ja,"['O', 'O', 'O', 'O', 'O', 'B-GPE', 'O', 'B-GPE', 'O']","['O', 'O']","['Which', 'country', 'has', 'more', 'population', 'Brazil', 'or', 'Mexico', '?']","['ブラジルとメキシコではどちらの国が人口が多いですか', '？']"
4550,How many main islands does Hawaii have?,ハワイにはいくつの主要な島がありますか？,en,ja,"['O', 'O', 'O', 'O', 'O', 'B-GPE', 'O', 'O']","['B-GPE', 'O']","['How', 'many', 'main', 'islands', 'does', 'Hawaii', 'have', '?']","['ハワイにはいくつの主要な島がありますか', '？']"
6812,Which First Lady never lived in the White House because her husband died one month into his presidency?,大統領が就任から1か月で死去したためホワイトハウスに住まなかったファーストレディーは誰？,en,ja,"['O', 'O', 'O', 'O', 'O', 'O', 'B-FAC', 'I-FAC', 'I-FAC', 'O', 'O', 'O', 'O', 'B-DATE', 'I-DATE', 'O', 'O', 'O', 'O']","['O', 'O']","['Which', 'First', 'Lady', 'never', 'lived', 'in', 'the', 'White', 'House', 'because', 'her', 'husband', 'died', 'one', 'month', 'into', 'his', 'presidency', '?']","['大統領が就任から1か月で死去したためホワイトハウスに住まなかったファーストレディーは誰', '？']"
4471,What is the shortest A Song of Ice and Fire book in pages?,『氷と炎の歌』シリーズの中で、ページ数の一番少ないのはどちらですか？,en,ja,"['O', 'O', 'O', 'O', 'B-WORK_OF_ART', 'I-WORK_OF_ART', 'I-WORK_OF_ART', 'I-WORK_OF_ART', 'I-WORK_OF_ART', 'I-WORK_OF_ART', 'O', 'O', 'O', 'O']","['B-WORK_OF_ART', 'I-WORK_OF_ART', 'I-WORK_OF_ART', 'O', 'O', 'O', 'O']","['What', 'is', 'the', 'shortest', 'A', 'Song', 'of', 'Ice', 'and', 'Fire', 'book', 'in', 'pages', '?']","['『', '氷と炎の歌', '』', 'シリーズの中で', '、', 'ページ数の一番少ないのはどちらですか', '？']"
23,Was Friday the 13th released the same year as Halloween?,13日の金曜日とハロウィンは同じ年に公開されましたか？,en,ja,"['O', 'B-DATE', 'I-DATE', 'I-DATE', 'O', 'B-DATE', 'I-DATE', 'I-DATE', 'O', 'B-DATE', 'O']","['O', 'O']","['Was', 'Friday', 'the', '13th', 'released', 'the', 'same', 'year', 'as', 'Halloween', '?']","['13日の金曜日とハロウィンは同じ年に公開されましたか', '？']"
3254,How many people won the 1956 Nobel Prize in Physics?,1956年のノーベル物理学賞は何人が受賞した？,en,ja,"['O', 'O', 'O', 'O', 'O', 'B-DATE', 'B-WORK_OF_ART', 'I-WORK_OF_ART', 'I-WORK_OF_ART', 'I-WORK_OF_ART', 'O']","['B-DATE', 'O', 'O']","['How', 'many', 'people', 'won', 'the', '1956', 'Nobel', 'Prize', 'in', 'Physics', '?']","['1956', '年のノーベル物理学賞は何人が受賞した', '？']"
6956,How many times have the Boston Bruins lost in the Stanley Cup finals?,スタンレー・カップ決勝戦で、ボストン・ブルーインズは何回負けた?,en,ja,"['O', 'O', 'O', 'O', 'B-ORG', 'I-ORG', 'I-ORG', 'O', 'O', 'O', 'B-EVENT', 'I-EVENT', 'O', 'O']","['B-EVENT', 'I-EVENT', 'I-EVENT', 'O', 'B-ORG', 'I-ORG', 'I-ORG', 'O']","['How', 'many', 'times', 'have', 'the', 'Boston', 'Bruins', 'lost', 'in', 'the', 'Stanley', 'Cup', 'finals', '?']","['スタンレー', '・', 'カップ決勝戦で', '、', 'ボストン', '・', 'ブルーインズは何回負けた', '?']"
3407,Who was a California governor and a winner of Mister Olympia bodybuilding contest?,カリフォルニア知事で、ミスターオリンピア、ボディビル大会で優勝したのは?,en,ja,"['O', 'O', 'O', 'B-GPE', 'O', 'O', 'O', 'O', 'O', 'O', 'B-WORK_OF_ART', 'O', 'O', 'O']","['B-GPE', 'O', 'B-EVENT', 'O', 'B-EVENT', 'O']","['Who', 'was', 'a', 'California', 'governor', 'and', 'a', 'winner', 'of', 'Mister', 'Olympia', 'bodybuilding', 'contest', '?']","['カリフォルニア知事で', '、', 'ミスターオリンピア', '、', 'ボディビル大会で優勝したのは', '?']"
5097,How many games take place before Lufia I?,『エストポリス伝記』より以前にいくつゲームがありますか？,en,ja,"['O', 'O', 'O', 'O', 'O', 'O', 'B-PERSON', 'I-PERSON', 'O']","['B-WORK_OF_ART', 'I-WORK_OF_ART', 'I-WORK_OF_ART', 'O', 'O']","['How', 'many', 'games', 'take', 'place', 'before', 'Lufia', 'I', '?']","['『', 'エストポリス伝記', '』', 'より以前にいくつゲームがありますか', '？']"
2177,What is the tallest building in the capital of New York?,ニューヨーク州の州都にある一番高いビルは何ですか？,en,ja,"['O', 'O', 'O', 'O', 'O', 'O', 'O', 'O', 'O', 'B-GPE', 'I-GPE', 'O']","['O', 'O']","['What', 'is', 'the', 'tallest', 'building', 'in', 'the', 'capital', 'of', 'New', 'York', '?']","['ニューヨーク州の州都にある一番高いビルは何ですか', '？']"
3529,Who was the wife of the president during the Civil War?,南北戦争時の大統領の妻だったのは誰ですか？,en,ja,"['O', 'O', 'O', 'O', 'O', 'O', 'O', 'O', 'B-EVENT', 'I-EVENT', 'I-EVENT', 'O']","['O', 'O']","['Who', 'was', 'the', 'wife', 'of', 'the', 'president', 'during', 'the', 'Civil', 'War', '?']","['南北戦争時の大統領の妻だったのは誰ですか', '？']"
2941,What was the first spin-off game released in the Assassin's Creed franchise not to be released on a Sony console?,ソニーのコンソールでなく、アサシンクリードのフランチャイズで発売された最初のスピンオフのゲームはなんでしたか？,en,ja,"['O', 'O', 'O', 'B-ORDINAL', 'O', 'O', 'O', 'O', 'O', 'O', 'O', 'B-WORK_OF_ART', 'I-WORK_OF_ART', 'O', 'O', 'O', 'O', 'O', 'O', 'O', 'B-ORG', 'O', 'O']","['B-ORG', 'O', 'O', 'O']","['What', 'was', 'the', 'first', 'spin', '-', 'off', 'game', 'released', 'in', 'the', ""Assassin's"", 'Creed', 'franchise', 'not', 'to', 'be', 'released', 'on', 'a', 'Sony', 'console', '?']","['ソニーのコンソールでなく', '、', 'アサシンクリードのフランチャイズで発売された最初のスピンオフのゲームはなんでしたか', '？']"
3795,Was Constantinople captured by the Ottoman Empire in 1453?,コンスタンティノープルは1453年にオスマン帝国に占拠されましたか?,en,ja,"['O', 'B-GPE', 'O', 'O', 'B-GPE', 'I-GPE', 'I-GPE', 'O', 'B-DATE', 'O']","['O', 'O']","['Was', 'Constantinople', 'captured', 'by', 'the', 'Ottoman', 'Empire', 'in', '1453', '?']","['コンスタンティノープルは1453年にオスマン帝国に占拠されましたか', '?']"
1419,Did The Metamorphosis come out before Franz Kafka died?,「変身」はフランツ・カフカが死去する以前に発表されましたか?,en,ja,"['O', 'O', 'O', 'O', 'O', 'O', 'B-PERSON', 'I-PERSON', 'O', 'O']","['O', 'O', 'O', 'O', 'O', 'O', 'O']","['Did', 'The', 'Metamorphosis', 'come', 'out', 'before', 'Franz', 'Kafka', 'died', '?']","['「', '変身', '」', 'はフランツ', '・', 'カフカが死去する以前に発表されましたか', '?']"
445,Did Short Circuit have 3 movies?,映画『ショート・サーキット』は三部作ですか？,en,ja,"['O', 'B-ORG', 'I-ORG', 'O', 'B-CARDINAL', 'O', 'O']","['O', 'B-WORK_OF_ART', 'I-WORK_OF_ART', 'I-WORK_OF_ART', 'I-WORK_OF_ART', 'I-WORK_OF_ART', 'O', 'O']","['Did', 'Short', 'Circuit', 'have', '3', 'movies', '?']","['映画', '『', 'ショート', '・', 'サーキット', '』', 'は三部作ですか', '？']"
5377,What hip hop trio was Snoop Dogg in?,スヌープ・ドッグはどのヒップホップトリオにいたでしょうか？,en,ja,"['O', 'O', 'O', 'O', 'O', 'B-PERSON', 'I-PERSON', 'O', 'O']","['O', 'O', 'O', 'O']","['What', 'hip', 'hop', 'trio', 'was', 'Snoop', 'Dogg', 'in', '?']","['スヌープ', '・', 'ドッグはどのヒップホップトリオにいたでしょうか', '？']"
1436,How many books are in the Chronicles of Narnia?,ナルニア物語は何巻までありますか?,en,ja,"['O', 'O', 'O', 'O', 'O', 'B-WORK_OF_ART', 'I-WORK_OF_ART', 'I-WORK_OF_ART', 'I-WORK_OF_ART', 'O']","['B-PERSON', 'O']","['How', 'many', 'books', 'are', 'in', 'the', 'Chronicles', 'of', 'Narnia', '?']","['ナルニア物語は何巻までありますか', '?']"
2561,How many US House of Representative seats does Maine have?,メイン州の下院議員の議席はいくつですか？,en,ja,"['O', 'O', 'B-ORG', 'B-ORG', 'I-ORG', 'I-ORG', 'O', 'O', 'B-GPE', 'O', 'O']","['O', 'O']","['How', 'many', 'US', 'House', 'of', 'Representative', 'seats', 'does', 'Maine', 'have', '?']","['メイン州の下院議員の議席はいくつですか', '？']"
3946,How many movies have grossed over $2 billion worldwide?,世界で20億ドル以上の総興行収入を挙げた映画の数はいくつ？,en,ja,"['O', 'O', 'O', 'O', 'O', 'B-MONEY', 'I-MONEY', 'I-MONEY', 'I-MONEY', 'O', 'O']","['O', 'O']","['How', 'many', 'movies', 'have', 'grossed', 'over', '$', '2', 'billion', 'worldwide', '?']","['世界で20億ドル以上の総興行収入を挙げた映画の数はいくつ', '？']"
2858,Was Donald Trump the governor of New York previous to becoming U.S. president?,ドナルド・トランプはアメリカ大統領の前はニューヨーク州知事だった?,en,ja,"['O', 'B-PERSON', 'I-PERSON', 'O', 'O', 'O', 'B-GPE', 'I-GPE', 'O', 'O', 'O', 'B-GPE', 'O', 'O']","['B-PERSON', 'I-PERSON', 'I-PERSON', 'I-PERSON']","['Was', 'Donald', 'Trump', 'the', 'governor', 'of', 'New', 'York', 'previous', 'to', 'becoming', 'U.S.', 'president', '?']","['ドナルド', '・', 'トランプはアメリカ大統領の前はニューヨーク州知事だった', '?']"
6314,How old was India's only female prime minister when she died?,インドの唯一の女性首相は何歳になくなりましたか？,en,ja,"['O', 'O', 'O', 'B-GPE', 'O', 'O', 'O', 'O', 'O', 'O', 'O', 'O']","['O', 'O']","['How', 'old', 'was', ""India's"", 'only', 'female', 'prime', 'minister', 'when', 'she', 'died', '?']","['インドの唯一の女性首相は何歳になくなりましたか', '？']"
1891,How many countries in South America are landlocked?,南アメリカでは何か国が内陸部に位置していますか？,en,ja,"['O', 'O', 'O', 'O', 'B-LOC', 'I-LOC', 'O', 'O', 'O']","['O', 'O']","['How', 'many', 'countries', 'in', 'South', 'America', 'are', 'landlocked', '?']","['南アメリカでは何か国が内陸部に位置していますか', '？']"
4304,Who was the quarterback of the team that won Super Bowl XLVIII?,第48回スーパーボウルで勝利したチームのクォーターバックは誰でしたか？,en,ja,"['O', 'O', 'O', 'O', 'O', 'O', 'O', 'O', 'O', 'B-EVENT', 'I-EVENT', 'I-EVENT', 'O']","['O', 'O']","['Who', 'was', 'the', 'quarterback', 'of', 'the', 'team', 'that', 'won', 'Super', 'Bowl', 'XLVIII', '?']","['第48回スーパーボウルで勝利したチームのクォーターバックは誰でしたか', '？']"
2586,Which Democratic candidate did not win the general election in both 1952 and 1956?,1952年と1956年の一般選挙の両方に落選した民主党の立候補者は誰?,en,ja,"['O', 'B-NORP', 'O', 'O', 'O', 'O', 'O', 'O', 'O', 'O', 'O', 'B-DATE', 'O', 'B-DATE', 'O']","['B-DATE', 'O', 'O']","['Which', 'Democratic', 'candidate', 'did', 'not', 'win', 'the', 'general', 'election', 'in', 'both', '1952', 'and', '1956', '?']","['1952', '年と1956年の一般選挙の両方に落選した民主党の立候補者は誰', '?']"
828,Are the Rolling Stones from the UK?,ローリングストーンズはイギリス出身ですか？,en,ja,"['O', 'B-ORG', 'I-ORG', 'I-ORG', 'O', 'O', 'B-GPE', 'O']","['B-GPE', 'O']","['Are', 'the', 'Rolling', 'Stones', 'from', 'the', 'UK', '?']","['ローリングストーンズはイギリス出身ですか', '？']"
7021,Does Ohio have more U.S. senators than New York?,オハイオ州にはニューヨーク州よりも多くの上院議員がいますか？,en,ja,"['O', 'B-GPE', 'O', 'O', 'B-GPE', 'O', 'O', 'B-GPE', 'I-GPE', 'O']","['O', 'O']","['Does', 'Ohio', 'have', 'more', 'U.S.', 'senators', 'than', 'New', 'York', '?']","['オハイオ州にはニューヨーク州よりも多くの上院議員がいますか', '？']"
1649,When did the first Sherlock Holmes story come out?,最初のシャーロック・ホームズはいつ出版しましたか？,en,ja,"['O', 'O', 'O', 'B-ORDINAL', 'B-PERSON', 'I-PERSON', 'O', 'O', 'O', 'O']","['O', 'B-PERSON', 'I-PERSON', 'O']","['When', 'did', 'the', 'first', 'Sherlock', 'Holmes', 'story', 'come', 'out', '?']","['最初のシャーロック', '・', 'ホームズはいつ出版しましたか', '？']"
3393,Which state didn't send delegates to the US Constitutional Convention of 1787?,1787年のフィラデルフィア憲法制会議に代表を派遣しなかった州はどこですか？,en,ja,"['O', 'O', 'O', 'O', 'O', 'O', 'B-EVENT', 'I-EVENT', 'I-EVENT', 'I-EVENT', 'I-EVENT', 'I-EVENT', 'O']","['B-DATE', 'O', 'O']","['Which', 'state', ""didn't"", 'send', 'delegates', 'to', 'the', 'US', 'Constitutional', 'Convention', 'of', '1787', '?']","['1787', '年のフィラデルフィア憲法制会議に代表を派遣しなかった州はどこですか', '？']"
2648,Who ran for president in 2020 and graduated from Dartmouth College?,ダートマス大学卒で2020年に大統領に立候補したのは誰ですか？,en,ja,"['O', 'O', 'O', 'O', 'O', 'B-DATE', 'O', 'O', 'O', 'B-ORG', 'I-ORG', 'O']","['O', 'O']","['Who', 'ran', 'for', 'president', 'in', '2020', 'and', 'graduated', 'from', 'Dartmouth', 'College', '?']","['ダートマス大学卒で2020年に大統領に立候補したのは誰ですか', '？']"
2473,"Which UK prime minister was older when elected, Margaret Thatcher or John Major?","""イギリスの首相マーガレット・サッチャーとジョン・メジャーでは、選出されたときはどちらが年上だった？""",en,ja,"['O', 'B-GPE', 'O', 'O', 'O', 'O', 'O', 'O', 'O', 'B-PERSON', 'I-PERSON', 'O', 'B-PERSON', 'I-PERSON', 'O']","['O', 'B-GPE', 'B-PERSON', 'I-PERSON', 'I-PERSON', 'I-PERSON', 'O', 'O', 'O', 'O']","['Which', 'UK', 'prime', 'minister', 'was', 'older', 'when', 'elected', ',', 'Margaret', 'Thatcher', 'or', 'John', 'Major', '?']","['""', 'イギリスの首相マーガレット', '・', 'サッチャーとジョン', '・', 'メジャーでは', '、', '選出されたときはどちらが年上だった', '？', '""']"
932,How many Super Bowls has Brett Favre won?,ブレット・ファーヴはスーパーボウルで何回勝ちましたか？,en,ja,"['O', 'O', 'B-EVENT', 'I-EVENT', 'O', 'B-PERSON', 'I-PERSON', 'O', 'O']","['B-PERSON', 'O', 'O', 'O']","['How', 'many', 'Super', 'Bowls', 'has', 'Brett', 'Favre', 'won', '?']","['ブレット', '・', 'ファーヴはスーパーボウルで何回勝ちましたか', '？']"
6199,What year was the Mongol Empire founded?,モンゴル帝国の建国は何年ですか？,en,ja,"['O', 'O', 'O', 'B-GPE', 'I-GPE', 'I-GPE', 'O', 'O']","['B-GPE', 'O']","['What', 'year', 'was', 'the', 'Mongol', 'Empire', 'founded', '?']","['モンゴル帝国の建国は何年ですか', '？']"
6446,What is the fourth British Rolling Stones' studio album called?,イギリス盤のローリング・ストーンズの4枚目のスタジオアルバムは何？,en,ja,"['O', 'O', 'O', 'B-ORDINAL', 'B-NORP', 'B-ORG', 'I-ORG', 'O', 'O', 'O', 'O']","['B-GPE', 'B-ORG', 'I-ORG', 'O']","['What', 'is', 'the', 'fourth', 'British', 'Rolling', ""Stones'"", 'studio', 'album', 'called', '?']","['イギリス盤のローリング', '・', 'ストーンズの4枚目のスタジオアルバムは何', '？']"
5748,In which state is Mount Rushmore monument located?,ラッシュモア山の記念碑があるのはどの州？,en,ja,"['O', 'O', 'O', 'O', 'B-FAC', 'I-FAC', 'O', 'O', 'O']","['B-LOC', 'O']","['In', 'which', 'state', 'is', 'Mount', 'Rushmore', 'monument', 'located', '?']","['ラッシュモア山の記念碑があるのはどの州', '？']"
2697,Which Chicago native ran for president in 2008?,シカゴ生まれで2008年に大統領に立候補したのは誰ですか？,en,ja,"['O', 'B-GPE', 'O', 'O', 'O', 'O', 'O', 'B-DATE', 'O']","['O', 'O']","['Which', 'Chicago', 'native', 'ran', 'for', 'president', 'in', '2008', '?']","['シカゴ生まれで2008年に大統領に立候補したのは誰ですか', '？']"
2465,"Which state has more electoral votes, Hawaii or Illinois?","""選挙人投票数が多いのは、ハワイかイリノイのどっち?""",en,ja,"['O', 'O', 'O', 'O', 'O', 'O', 'O', 'B-GPE', 'O', 'B-GPE', 'O']","['O', 'O', 'O', 'B-GPE', 'O', 'O']","['Which', 'state', 'has', 'more', 'electoral', 'votes', ',', 'Hawaii', 'or', 'Illinois', '?']","['""', '選挙人投票数が多いのは', '、', 'ハワイかイリノイのどっち', '?', '""']"
4824,"What is the full name of the wife, as of 2020, of the U.S. senator who was once mayor of Burlington, Vermont?","""2020年現在、バーモント州バーリントン市長を務めたアメリカ上院議員の妻のフルネームは何ですか？""",en,ja,"['O', 'O', 'O', 'O', 'O', 'O', 'O', 'O', 'O', 'O', 'O', 'B-DATE', 'O', 'O', 'O', 'B-GPE', 'O', 'O', 'O', 'O', 'O', 'O', 'B-GPE', 'O', 'B-GPE', 'O']","['O', 'B-DATE', 'I-DATE', 'O', 'O', 'O', 'O']","['What', 'is', 'the', 'full', 'name', 'of', 'the', 'wife', ',', 'as', 'of', '2020', ',', 'of', 'the', 'U.S.', 'senator', 'who', 'was', 'once', 'mayor', 'of', 'Burlington', ',', 'Vermont', '?']","['""', '2020', '年現在', '、', 'バーモント州バーリントン市長を務めたアメリカ上院議員の妻のフルネームは何ですか', '？', '""']"
1412,Is George RR Martin older than J.K. Rowling?,ジョージ・R・R・マーティンは、J・K・ローリングよりも年上ですか？,en,ja,"['O', 'B-PERSON', 'I-PERSON', 'I-PERSON', 'O', 'O', 'B-PERSON', 'I-PERSON', 'O']","['B-PERSON', 'I-PERSON', 'I-PERSON', 'I-PERSON', 'I-PERSON', 'I-PERSON', 'I-PERSON', 'O', 'B-PERSON', 'B-PERSON', 'I-PERSON', 'I-PERSON', 'I-PERSON', 'O']","['Is', 'George', 'RR', 'Martin', 'older', 'than', 'J.K.', 'Rowling', '?']","['ジョージ', '・', 'R', '・', 'R', '・', 'マーティンは', '、', 'J', '・', 'K', '・', 'ローリングよりも年上ですか', '？']"
1922,How many U.S. states touch the Pacific Ocean?,アメリカ合衆国で、太平洋に接する州はいくつありますか？,en,ja,"['O', 'O', 'B-GPE', 'O', 'O', 'B-LOC', 'I-LOC', 'I-LOC', 'O']","['B-GPE', 'O', 'B-LOC', 'O']","['How', 'many', 'U.S.', 'states', 'touch', 'the', 'Pacific', 'Ocean', '?']","['アメリカ合衆国で', '、', '太平洋に接する州はいくつありますか', '？']"
2917,In which God of War game do you not fight Greek gods?,ゴッド・オブ・ウォーのゲームでギリシャの神々との戦いがないものはどれですか？,en,ja,"['O', 'O', 'O', 'O', 'O', 'O', 'O', 'O', 'O', 'O', 'O', 'O', 'O']","['B-PERSON', 'O', 'O', 'O', 'O', 'O']","['In', 'which', 'God', 'of', 'War', 'game', 'do', 'you', 'not', 'fight', 'Greek', 'gods', '?']","['ゴッド', '・', 'オブ', '・', 'ウォーのゲームでギリシャの神々との戦いがないものはどれですか', '？']"
2592,Which senators of Kansas have not been Republican since 1900?,1900年以降、カンザスの上院議員で共和党員でなかったのは?,en,ja,"['O', 'O', 'O', 'B-GPE', 'O', 'O', 'O', 'B-NORP', 'O', 'B-DATE', 'O']","['B-DATE', 'I-DATE', 'O', 'O', 'O']","['Which', 'senators', 'of', 'Kansas', 'have', 'not', 'been', 'Republican', 'since', '1900', '?']","['1900', '年以降', '、', 'カンザスの上院議員で共和党員でなかったのは', '?']"
3077,"Which war lasted longer, the Korean War or the Vietnam War?","""朝鮮戦争とベトナム戦争、どっちの方が長く続いた？""",en,ja,"['O', 'O', 'O', 'O', 'O', 'B-EVENT', 'I-EVENT', 'I-EVENT', 'O', 'B-EVENT', 'I-EVENT', 'I-EVENT', 'O']","['O', 'B-EVENT', 'O', 'O', 'O', 'O']","['Which', 'war', 'lasted', 'longer', ',', 'the', 'Korean', 'War', 'or', 'the', 'Vietnam', 'War', '?']","['""', '朝鮮戦争とベトナム戦争', '、', 'どっちの方が長く続いた', '？', '""']"
