,source_text,target_text,source_lang,target_lang,source_text_ner,target_text_ner,source_text_ner_tokens,target_text_ner_tokens
1737,Was the Dirk Pitt series created by Clive Cussler?,「ダーク・ピット」シリーズはクライブ・カッスラーが生み出しましたか？,en,ja,"['O', 'O', 'B-PERSON', 'I-PERSON', 'O', 'O', 'O', 'B-PERSON', 'I-PERSON', 'O']","['O', 'B-WORK_OF_ART', 'I-WORK_OF_ART', 'I-WORK_OF_ART', 'O', 'O', 'O', 'O', 'O']","['Was', 'the', 'Dirk', 'Pitt', 'series', 'created', 'by', 'Clive', 'Cussler', '?']","['「', 'ダーク', '・', 'ピット', '」', 'シリーズはクライブ', '・', 'カッスラーが生み出しましたか', '？']"
2753,Who was the first president of France?,フランスの初代大統領は誰ですか？,en,ja,"['O', 'O', 'O', 'B-ORDINAL', 'O', 'O', 'B-GPE', 'O']","['B-GPE', 'O']","['Who', 'was', 'the', 'first', 'president', 'of', 'France', '?']","['フランスの初代大統領は誰ですか', '？']"
4922,What is the capital of the country with mainland Europe's only active volcano?,ヨーロッパ本土で唯一の活火山がある国の首都はどこですか？,en,ja,"['O', 'O', 'O', 'O', 'O', 'O', 'O', 'O', 'O', 'B-LOC', 'O', 'O', 'O', 'O']","['O', 'O']","['What', 'is', 'the', 'capital', 'of', 'the', 'country', 'with', 'mainland', ""Europe's"", 'only', 'active', 'volcano', '?']","['ヨーロッパ本土で唯一の活火山がある国の首都はどこですか', '？']"
5787,Which city uses zero stop signs for cars?,車の停止標識を全く使っていない都市はどれですか？,en,ja,"['O', 'O', 'O', 'B-CARDINAL', 'O', 'O', 'O', 'O', 'O']","['O', 'O']","['Which', 'city', 'uses', 'zero', 'stop', 'signs', 'for', 'cars', '?']","['車の停止標識を全く使っていない都市はどれですか', '？']"
1352,Does Los Angeles have more than one football team?,ロサンゼルスには複数のフットボールチームがありますか？,en,ja,"['O', 'B-GPE', 'I-GPE', 'O', 'B-CARDINAL', 'I-CARDINAL', 'I-CARDINAL', 'O', 'O', 'O']","['O', 'O']","['Does', 'Los', 'Angeles', 'have', 'more', 'than', 'one', 'football', 'team', '?']","['ロサンゼルスには複数のフットボールチームがありますか', '？']"
2778,Who was the 25th president of the United States?,アメリカ合衆国の第25代大統領は誰ですか？,en,ja,"['O', 'O', 'O', 'B-ORDINAL', 'O', 'O', 'B-GPE', 'I-GPE', 'I-GPE', 'O']","['O', 'O']","['Who', 'was', 'the', '25th', 'president', 'of', 'the', 'United', 'States', '?']","['アメリカ合衆国の第25代大統領は誰ですか', '？']"
1315,Have the Cleveland Browns ever won a Super Bowl?,クリーブランド・ブラウンズはスーパーボウルで優勝したことがありますか？,en,ja,"['O', 'B-ORG', 'I-ORG', 'I-ORG', 'O', 'O', 'B-EVENT', 'I-EVENT', 'I-EVENT', 'O']","['B-GPE', 'O', 'O', 'O']","['Have', 'the', 'Cleveland', 'Browns', 'ever', 'won', 'a', 'Super', 'Bowl', '?']","['クリーブランド', '・', 'ブラウンズはスーパーボウルで優勝したことがありますか', '？']"
1703,Are there seven books in The Chronicles of Narnia series?,ナルニア国物語には７つ本がありますか？,en,ja,"['O', 'O', 'B-CARDINAL', 'O', 'O', 'B-WORK_OF_ART', 'I-WORK_OF_ART', 'I-WORK_OF_ART', 'I-WORK_OF_ART', 'O', 'O']","['B-NORP', 'O']","['Are', 'there', 'seven', 'books', 'in', 'The', 'Chronicles', 'of', 'Narnia', 'series', '?']","['ナルニア国物語には７つ本がありますか', '？']"
1817,"Which country has the smaller population, Germany or Poland?","""ドイツとポーランドの人口は、どちらのほうが少ないですか？""",en,ja,"['O', 'O', 'O', 'O', 'O', 'O', 'O', 'B-GPE', 'O', 'B-GPE', 'O']","['O', 'B-GPE', 'O', 'O', 'O', 'O']","['Which', 'country', 'has', 'the', 'smaller', 'population', ',', 'Germany', 'or', 'Poland', '?']","['""', 'ドイツとポーランドの人口は', '、', 'どちらのほうが少ないですか', '？', '""']"
4985,How many deserts in the world have an area of more than 3 million square miles?,300万平方マイルよりも大きい砂漠は世界にいくつありますか？,en,ja,"['O', 'O', 'O', 'O', 'O', 'O', 'O', 'O', 'O', 'O', 'B-QUANTITY', 'I-QUANTITY', 'I-QUANTITY', 'I-QUANTITY', 'I-QUANTITY', 'I-QUANTITY', 'O']","['B-CARDINAL', 'O', 'O']","['How', 'many', 'deserts', 'in', 'the', 'world', 'have', 'an', 'area', 'of', 'more', 'than', '3', 'million', 'square', 'miles', '?']","['300', '万平方マイルよりも大きい砂漠は世界にいくつありますか', '？']"
1650,What was Hunter Thompson's fifth book?,ハンター・S・トンプソンの5冊目の本は何ですか？,en,ja,"['O', 'O', 'B-PERSON', 'I-PERSON', 'B-ORDINAL', 'O', 'O']","['B-PERSON', 'I-PERSON', 'I-PERSON', 'I-PERSON', 'I-PERSON', 'O']","['What', 'was', 'Hunter', ""Thompson's"", 'fifth', 'book', '?']","['ハンター', '・', 'S', '・', 'トンプソンの5冊目の本は何ですか', '？']"
5113,Which state borders Canada and is not a contiguous state?,カナダとは隣国の関係ですが、国土に隣接していない州はどれですか？,en,ja,"['O', 'O', 'O', 'B-GPE', 'O', 'O', 'O', 'O', 'O', 'O', 'O']","['B-GPE', 'O', 'O', 'O']","['Which', 'state', 'borders', 'Canada', 'and', 'is', 'not', 'a', 'contiguous', 'state', '?']","['カナダとは隣国の関係ですが', '、', '国土に隣接していない州はどれですか', '？']"
1511,Which books in the Saga of Darren Shan have not been made into a movie?,小説ダレン・シャンシリーズの中で、映画化されてない巻はどれですか？,en,ja,"['O', 'O', 'O', 'B-WORK_OF_ART', 'I-WORK_OF_ART', 'I-WORK_OF_ART', 'B-PERSON', 'I-PERSON', 'O', 'O', 'O', 'O', 'O', 'O', 'O', 'O']","['B-WORK_OF_ART', 'I-WORK_OF_ART', 'I-WORK_OF_ART', 'O', 'O', 'O']","['Which', 'books', 'in', 'the', 'Saga', 'of', 'Darren', 'Shan', 'have', 'not', 'been', 'made', 'into', 'a', 'movie', '?']","['小説ダレン', '・', 'シャンシリーズの中で', '、', '映画化されてない巻はどれですか', '？']"
4915,Did Robert Frost win a Pulitzer Prize?,ロバートフロストはピューリッツァー賞を受賞しましたか？,en,ja,"['O', 'B-PERSON', 'I-PERSON', 'O', 'B-WORK_OF_ART', 'I-WORK_OF_ART', 'I-WORK_OF_ART', 'O']","['O', 'O']","['Did', 'Robert', 'Frost', 'win', 'a', 'Pulitzer', 'Prize', '?']","['ロバートフロストはピューリッツァー賞を受賞しましたか', '？']"
4701,How tall is the most active volcano in the world?,世界で最も活発な火山の標高はいくつですか？,en,ja,"['O', 'O', 'O', 'O', 'O', 'O', 'O', 'O', 'O', 'O', 'O']","['O', 'O']","['How', 'tall', 'is', 'the', 'most', 'active', 'volcano', 'in', 'the', 'world', '?']","['世界で最も活発な火山の標高はいくつですか', '？']"
5969,What is the largest country of Africa in population?,アフリカで人口が一番多い国はどこですか？,en,ja,"['O', 'O', 'O', 'O', 'O', 'O', 'B-LOC', 'O', 'O', 'O']","['B-LOC', 'O']","['What', 'is', 'the', 'largest', 'country', 'of', 'Africa', 'in', 'population', '?']","['アフリカで人口が一番多い国はどこですか', '？']"
84,How many times has Francis Ford Coppola won Best Director?,フランシス・フォード・コッポラが受賞した監督賞はいくつあるでしょう?,en,ja,"['O', 'O', 'O', 'O', 'B-PERSON', 'I-PERSON', 'I-PERSON', 'O', 'O', 'O', 'O']","['B-PERSON', 'I-PERSON', 'I-PERSON', 'I-PERSON', 'I-PERSON', 'I-PERSON']","['How', 'many', 'times', 'has', 'Francis', 'Ford', 'Coppola', 'won', 'Best', 'Director', '?']","['フランシス', '・', 'フォード', '・', 'コッポラが受賞した監督賞はいくつあるでしょう', '?']"
5272,When did Chris Pratt marry Anna Faris?,クリス・プラットはいつアンナ・ファリスと結婚しましたか？,en,ja,"['O', 'O', 'B-PERSON', 'I-PERSON', 'O', 'B-PERSON', 'I-PERSON', 'O']","['B-PERSON', 'I-PERSON', 'I-PERSON', 'I-PERSON', 'I-PERSON', 'O']","['When', 'did', 'Chris', 'Pratt', 'marry', 'Anna', 'Faris', '?']","['クリス', '・', 'プラットはいつアンナ', '・', 'ファリスと結婚しましたか', '？']"
2317,What is the largest country in Africa by population?,アフリカで最も人口の多い国は?,en,ja,"['O', 'O', 'O', 'O', 'O', 'O', 'B-LOC', 'O', 'O', 'O']","['B-LOC', 'O']","['What', 'is', 'the', 'largest', 'country', 'in', 'Africa', 'by', 'population', '?']","['アフリカで最も人口の多い国は', '?']"
2966,What is the only game in the Legend of Zelda series to release on the Super Nintendo?,スーパーニンテンドーで唯一発売されたゼルダの伝説シリーズのゲームは何ですか?,en,ja,"['O', 'O', 'O', 'O', 'O', 'O', 'O', 'B-WORK_OF_ART', 'I-WORK_OF_ART', 'I-WORK_OF_ART', 'O', 'O', 'O', 'O', 'B-ORG', 'I-ORG', 'I-ORG', 'O']","['O', 'O']","['What', 'is', 'the', 'only', 'game', 'in', 'the', 'Legend', 'of', 'Zelda', 'series', 'to', 'release', 'on', 'the', 'Super', 'Nintendo', '?']","['スーパーニンテンドーで唯一発売されたゼルダの伝説シリーズのゲームは何ですか', '?']"
4919,What river flows through Germany and is the second longest river in Europe?,ヨーロッパで2番目に長いかわでドイツを通り抜ける川は何ですか？,en,ja,"['O', 'O', 'O', 'O', 'B-GPE', 'O', 'O', 'O', 'B-ORDINAL', 'O', 'O', 'O', 'B-LOC', 'O']","['O', 'O']","['What', 'river', 'flows', 'through', 'Germany', 'and', 'is', 'the', 'second', 'longest', 'river', 'in', 'Europe', '?']","['ヨーロッパで2番目に長いかわでドイツを通り抜ける川は何ですか', '？']"
5275,What year was the first Academy Awards ceremony held?,第一回アカデミー賞は何年でしたか？,en,ja,"['O', 'O', 'O', 'O', 'B-ORDINAL', 'B-WORK_OF_ART', 'I-WORK_OF_ART', 'O', 'O', 'O']","['O', 'O']","['What', 'year', 'was', 'the', 'first', 'Academy', 'Awards', 'ceremony', 'held', '?']","['第一回アカデミー賞は何年でしたか', '？']"
2576,Which 20th century presidential candidate who won Arkansas was neither a Democrat nor a Republican?,20世紀のどの大統領候補がアーカンソー州で共和党でも民主党でもない票を獲得した？,en,ja,"['O', 'B-DATE', 'I-DATE', 'O', 'O', 'O', 'O', 'B-GPE', 'O', 'O', 'O', 'B-NORP', 'O', 'O', 'B-NORP', 'O']","['O', 'O']","['Which', '20th', 'century', 'presidential', 'candidate', 'who', 'won', 'Arkansas', 'was', 'neither', 'a', 'Democrat', 'nor', 'a', 'Republican', '?']","['20世紀のどの大統領候補がアーカンソー州で共和党でも民主党でもない票を獲得した', '？']"
3921,Was Spider-Man: Homecoming released before Iron Man 3?,スパイダーマン・ホームカミングはアイロンマン3より前に公開された?,en,ja,"['O', 'B-WORK_OF_ART', 'I-WORK_OF_ART', 'I-WORK_OF_ART', 'I-WORK_OF_ART', 'O', 'O', 'B-WORK_OF_ART', 'I-WORK_OF_ART', 'I-WORK_OF_ART', 'O']","['B-PERSON', 'O', 'O', 'O']","['Was', 'Spider', '-', 'Man:', 'Homecoming', 'released', 'before', 'Iron', 'Man', '3', '?']","['スパイダーマン', '・', 'ホームカミングはアイロンマン3より前に公開された', '?']"
6549,Which of the 2 sections of the Christian Bible did not precede the advent and passion of Christ?,キリスト教の聖書のなかで、降臨節とキリストの受難の前に関していない2つの章は？,en,ja,"['O', 'O', 'O', 'O', 'O', 'O', 'O', 'O', 'O', 'O', 'O', 'O', 'O', 'O', 'O', 'O', 'O', 'O', 'O']","['O', 'O', 'O', 'O']","['Which', 'of', 'the', '2', 'sections', 'of', 'the', 'Christian', 'Bible', 'did', 'not', 'precede', 'the', 'advent', 'and', 'passion', 'of', 'Christ', '?']","['キリスト教の聖書のなかで', '、', '降臨節とキリストの受難の前に関していない2つの章は', '？']"
4778,Which governors of Florida since 1990 have not been Republican?,1990年以来、フロリダ州の知事で共和党でないのは誰ですか？,en,ja,"['O', 'O', 'O', 'B-GPE', 'O', 'B-DATE', 'O', 'O', 'O', 'B-NORP', 'O']","['B-DATE', 'I-DATE', 'O', 'O', 'O']","['Which', 'governors', 'of', 'Florida', 'since', '1990', 'have', 'not', 'been', 'Republican', '?']","['1990', '年以来', '、', 'フロリダ州の知事で共和党でないのは誰ですか', '？']"
4235,How many Super Bowls has Jim Kelly won?,ジム・ケリーはスーパーボウルを何回優勝した?,en,ja,"['O', 'O', 'B-EVENT', 'I-EVENT', 'O', 'B-PERSON', 'I-PERSON', 'O', 'O']","['B-PERSON', 'I-PERSON', 'I-PERSON', 'O']","['How', 'many', 'Super', 'Bowls', 'has', 'Jim', 'Kelly', 'won', '?']","['ジム', '・', 'ケリーはスーパーボウルを何回優勝した', '?']"
4458,What was the last Wheel of Time book written?,最後に書かれた時の車輪の本は何でしたか？,en,ja,"['O', 'O', 'O', 'O', 'B-WORK_OF_ART', 'I-WORK_OF_ART', 'I-WORK_OF_ART', 'O', 'O', 'O']","['O', 'O']","['What', 'was', 'the', 'last', 'Wheel', 'of', 'Time', 'book', 'written', '?']","['最後に書かれた時の車輪の本は何でしたか', '？']"
5697,In what country is Hadrian's Wall?,ハドリアヌスの長城はどこの国にありますか？,en,ja,"['O', 'O', 'O', 'O', 'B-PERSON', 'O', 'O']","['O', 'O']","['In', 'what', 'country', 'is', ""Hadrian's"", 'Wall', '?']","['ハドリアヌスの長城はどこの国にありますか', '？']"
5265,Who was the youngest person ever nominated for an Academy Award?,これまでにアカデミー賞でノミネートされた最年少の人は誰ですか？,en,ja,"['O', 'O', 'O', 'O', 'O', 'O', 'O', 'O', 'O', 'B-WORK_OF_ART', 'I-WORK_OF_ART', 'O']","['O', 'O']","['Who', 'was', 'the', 'youngest', 'person', 'ever', 'nominated', 'for', 'an', 'Academy', 'Award', '?']","['これまでにアカデミー賞でノミネートされた最年少の人は誰ですか', '？']"
5940,What year was the war between Egypt and Israel?,エジプトとイスラエルの戦争は何年でしたか？,en,ja,"['O', 'O', 'O', 'O', 'O', 'O', 'O', 'O', 'O', 'O']","['O', 'O']","['What', 'year', 'was', 'the', 'war', 'between', 'Egypt', 'and', 'Israel', '?']","['エジプトとイスラエルの戦争は何年でしたか', '？']"
7084,Who won the Oscar for Best Supporting Actor?,アカデミー助演男優賞を受けた俳優さんは誰ですか？,en,ja,"['O', 'O', 'O', 'B-WORK_OF_ART', 'O', 'O', 'O', 'O', 'O']","['O', 'O']","['Who', 'won', 'the', 'Oscar', 'for', 'Best', 'Supporting', 'Actor', '?']","['アカデミー助演男優賞を受けた俳優さんは誰ですか', '？']"
6807,How many queens has England had?,イングランドには何人の女王がいたの?,en,ja,"['O', 'O', 'O', 'O', 'B-GPE', 'O', 'O']","['B-GPE', 'O']","['How', 'many', 'queens', 'has', 'England', 'had', '?']","['イングランドには何人の女王がいたの', '?']"
6434,Which Grammy Award was Dirty Computer by Janelle Monáe nominated for but did not win?,ジャネール・モネイのDirty Computerがノミネートされ、受賞しなかったグラミー賞は何でしょうか？,en,ja,"['O', 'B-WORK_OF_ART', 'I-WORK_OF_ART', 'O', 'B-WORK_OF_ART', 'I-WORK_OF_ART', 'O', 'B-PERSON', 'I-PERSON', 'O', 'O', 'O', 'O', 'O', 'O', 'O']","['B-PERSON', 'I-PERSON', 'I-PERSON', 'I-PERSON', 'O', 'O', 'O']","['Which', 'Grammy', 'Award', 'was', 'Dirty', 'Computer', 'by', 'Janelle', 'Monáe', 'nominated', 'for', 'but', 'did', 'not', 'win', '?']","['ジャネール', '・', 'モネイのDirty', 'Computerがノミネートされ', '、', '受賞しなかったグラミー賞は何でしょうか', '？']"
6251,What country is the official Republic of China?,正式な中華民国はどこの国ですか？,en,ja,"['O', 'O', 'O', 'O', 'O', 'B-GPE', 'I-GPE', 'I-GPE', 'O']","['O', 'O']","['What', 'country', 'is', 'the', 'official', 'Republic', 'of', 'China', '?']","['正式な中華民国はどこの国ですか', '？']"
6408,Was Tom Cruise in 8 Mile?,トム・クルーズは「8マイル」に出演しましたか？,en,ja,"['O', 'B-PERSON', 'I-PERSON', 'O', 'B-WORK_OF_ART', 'I-WORK_OF_ART', 'O']","['B-PERSON', 'I-PERSON', 'I-PERSON', 'O', 'B-WORK_OF_ART', 'I-WORK_OF_ART', 'O', 'O']","['Was', 'Tom', 'Cruise', 'in', '8', 'Mile', '?']","['トム', '・', 'クルーズは', '「', '8マイル', '」', 'に出演しましたか', '？']"
5793,Which major city in Oregon sits on both the Columbia and Willamette Rivers?,コロンビア川とウィラメット川の両方に面しているオレゴン州の主要都市は？,en,ja,"['O', 'O', 'O', 'O', 'B-GPE', 'O', 'O', 'O', 'B-LOC', 'B-LOC', 'O', 'B-LOC', 'I-LOC', 'O']","['O', 'O']","['Which', 'major', 'city', 'in', 'Oregon', 'sits', 'on', 'both', 'the', 'Columbia', 'and', 'Willamette', 'Rivers', '?']","['コロンビア川とウィラメット川の両方に面しているオレゴン州の主要都市は', '？']"
5093,Who is Henry VIII's fourth wife?,ヘンリー8世の四番目の奥さんは誰ですか？,en,ja,"['O', 'O', 'B-PERSON', 'I-PERSON', 'B-ORDINAL', 'O', 'O']","['O', 'O']","['Who', 'is', 'Henry', ""VIII's"", 'fourth', 'wife', '?']","['ヘンリー8世の四番目の奥さんは誰ですか', '？']"
3450,Who was the leader of the Nazi Party and married to Eva Braun?,ナチ党のリーダーで、エヴァ・ブラウンと結婚したのは?,en,ja,"['O', 'O', 'O', 'O', 'O', 'B-ORG', 'I-ORG', 'I-ORG', 'O', 'O', 'O', 'B-PERSON', 'I-PERSON', 'O']","['B-ORG', 'O', 'B-PERSON', 'I-PERSON', 'I-PERSON', 'O']","['Who', 'was', 'the', 'leader', 'of', 'the', 'Nazi', 'Party', 'and', 'married', 'to', 'Eva', 'Braun', '?']","['ナチ党のリーダーで', '、', 'エヴァ', '・', 'ブラウンと結婚したのは', '?']"
4641,What is the population of the city where the Namsan Tower is located?,Nソウルタワーのある都市の人口は何人でしょうか？,en,ja,"['O', 'O', 'O', 'O', 'O', 'O', 'O', 'O', 'B-FAC', 'I-FAC', 'I-FAC', 'O', 'O', 'O']","['O', 'O']","['What', 'is', 'the', 'population', 'of', 'the', 'city', 'where', 'the', 'Namsan', 'Tower', 'is', 'located', '?']","['Nソウルタワーのある都市の人口は何人でしょうか', '？']"
4091,"Was Charlton Heston in ""The Ten Commandments""?","""チャールトン・ヘストンは「十戒」に出演していましたか?""",en,ja,"['O', 'B-PERSON', 'I-PERSON', 'O', 'B-WORK_OF_ART', 'I-WORK_OF_ART', 'I-WORK_OF_ART', 'I-WORK_OF_ART', 'I-WORK_OF_ART', 'O']","['O', 'B-PERSON', 'I-PERSON', 'I-PERSON', 'B-WORK_OF_ART', 'I-WORK_OF_ART', 'I-WORK_OF_ART', 'O', 'O', 'O']","['Was', 'Charlton', 'Heston', 'in', '""', 'The', 'Ten', 'Commandments', '""', '?']","['""', 'チャールトン', '・', 'ヘストンは', '「', '十戒', '」', 'に出演していましたか', '?', '""']"
4051,When was Jessica Chastain nominated for her first Oscar?,ジェシカ・チャステインが初めてアカデミー賞にノミネートされたのはいつ?,en,ja,"['O', 'O', 'B-PERSON', 'I-PERSON', 'O', 'O', 'O', 'B-ORDINAL', 'B-WORK_OF_ART', 'O']","['B-PERSON', 'O', 'O', 'O']","['When', 'was', 'Jessica', 'Chastain', 'nominated', 'for', 'her', 'first', 'Oscar', '?']","['ジェシカ', '・', 'チャステインが初めてアカデミー賞にノミネートされたのはいつ', '?']"
6879,Who was the longest reigning Roman emperor?,最も統治が長かったローマ帝国の皇帝は誰ですか？,en,ja,"['O', 'O', 'O', 'O', 'O', 'O', 'O', 'O']","['O', 'O']","['Who', 'was', 'the', 'longest', 'reigning', 'Roman', 'emperor', '?']","['最も統治が長かったローマ帝国の皇帝は誰ですか', '？']"
5465,What is the highest scoring Super Bowl?,最高得点のスーパーボウルはなんですか？,en,ja,"['O', 'O', 'O', 'O', 'O', 'B-EVENT', 'I-EVENT', 'O']","['O', 'O']","['What', 'is', 'the', 'highest', 'scoring', 'Super', 'Bowl', '?']","['最高得点のスーパーボウルはなんですか', '？']"
5548,Who is the current quarterback of the Seattle Seahawks?,シアトル・シーホークスの現在のクウォーターバックは誰ですか？,en,ja,"['O', 'O', 'O', 'O', 'O', 'O', 'B-ORG', 'I-ORG', 'I-ORG', 'O']","['B-GPE', 'O', 'O', 'O']","['Who', 'is', 'the', 'current', 'quarterback', 'of', 'the', 'Seattle', 'Seahawks', '?']","['シアトル', '・', 'シーホークスの現在のクウォーターバックは誰ですか', '？']"
3352,"Which dictator tried to invade Russia, but did not succeed?",ロシアを侵略しようとしたが成功しなかった支配者は誰ですか？,en,ja,"['O', 'O', 'O', 'O', 'O', 'B-GPE', 'O', 'O', 'O', 'O', 'O', 'O']","['O', 'O']","['Which', 'dictator', 'tried', 'to', 'invade', 'Russia', ',', 'but', 'did', 'not', 'succeed', '?']","['ロシアを侵略しようとしたが成功しなかった支配者は誰ですか', '？']"
2413,Is Mt. Everest the tallest mountain in the world?,エベレストは世界で一番高い山はエベレスト？,en,ja,"['O', 'B-LOC', 'I-LOC', 'O', 'O', 'O', 'O', 'O', 'O', 'O']","['O', 'O']","['Is', 'Mt.', 'Everest', 'the', 'tallest', 'mountain', 'in', 'the', 'world', '?']","['エベレストは世界で一番高い山はエベレスト', '？']"
373,Which Quentin Tarantino movie is the longest?,クエンティン・タランティーノの作品で一番時間が長いものはどれでしょう?,en,ja,"['O', 'B-PERSON', 'I-PERSON', 'O', 'O', 'O', 'O', 'O']","['B-PERSON', 'O', 'O', 'O']","['Which', 'Quentin', 'Tarantino', 'movie', 'is', 'the', 'longest', '?']","['クエンティン', '・', 'タランティーノの作品で一番時間が長いものはどれでしょう', '?']"
2407,Is the Pacific Ocean the deepest and largest ocean in the world?,太平洋は世界で最も深く、最も大きな海ですか?,en,ja,"['O', 'B-LOC', 'I-LOC', 'I-LOC', 'O', 'O', 'O', 'O', 'O', 'O', 'O', 'O', 'O']","['B-LOC', 'O', 'O', 'O']","['Is', 'the', 'Pacific', 'Ocean', 'the', 'deepest', 'and', 'largest', 'ocean', 'in', 'the', 'world', '?']","['太平洋は世界で最も深く', '、', '最も大きな海ですか', '?']"
6340,Which book in A Song of Ice and Fire also shares the name of a popular TV series?,氷と炎の歌のどの本で、人気テレビシリーズの名前も共有していますか？,en,ja,"['O', 'O', 'O', 'B-WORK_OF_ART', 'I-WORK_OF_ART', 'I-WORK_OF_ART', 'I-WORK_OF_ART', 'I-WORK_OF_ART', 'I-WORK_OF_ART', 'O', 'O', 'O', 'O', 'O', 'O', 'O', 'O', 'O', 'O']","['B-WORK_OF_ART', 'O', 'O', 'O']","['Which', 'book', 'in', 'A', 'Song', 'of', 'Ice', 'and', 'Fire', 'also', 'shares', 'the', 'name', 'of', 'a', 'popular', 'TV', 'series', '?']","['氷と炎の歌のどの本で', '、', '人気テレビシリーズの名前も共有していますか', '？']"
6718,Who was a senator from Tennessee and ran in the 1956 Democratic Primaries?,テネシーの上院議員で1956年の民主党予備選に参加したのは誰?,en,ja,"['O', 'O', 'O', 'O', 'O', 'B-GPE', 'O', 'O', 'O', 'O', 'B-DATE', 'B-NORP', 'O', 'O']","['O', 'O']","['Who', 'was', 'a', 'senator', 'from', 'Tennessee', 'and', 'ran', 'in', 'the', '1956', 'Democratic', 'Primaries', '?']","['テネシーの上院議員で1956年の民主党予備選に参加したのは誰', '?']"
3315,"What three countries formed a Grand Alliance during WW II, and who could not agree on how the War should be fought?",第二次大戦中の連合国の3か国の中で、戦争をどう戦うべきかに同意できなかったのはどこ？,en,ja,"['O', 'B-CARDINAL', 'O', 'O', 'O', 'O', 'O', 'O', 'B-EVENT', 'I-EVENT', 'O', 'O', 'O', 'O', 'O', 'O', 'O', 'O', 'O', 'B-EVENT', 'O', 'O', 'O', 'O']","['O', 'O', 'O', 'O']","['What', 'three', 'countries', 'formed', 'a', 'Grand', 'Alliance', 'during', 'WW', 'II', ',', 'and', 'who', 'could', 'not', 'agree', 'on', 'how', 'the', 'War', 'should', 'be', 'fought', '?']","['第二次大戦中の連合国の3か国の中で', '、', '戦争をどう戦うべきかに同意できなかったのはどこ', '？']"
1172,When did LeBron James win his first championship?,レブロン・ジェームズが、選手権で初めての勝利を収めたのは、いつですか？,en,ja,"['O', 'O', 'B-PERSON', 'I-PERSON', 'O', 'O', 'B-ORDINAL', 'O', 'O']","['B-PERSON', 'I-PERSON', 'I-PERSON', 'O', 'B-EVENT', 'O', 'O', 'O']","['When', 'did', 'LeBron', 'James', 'win', 'his', 'first', 'championship', '?']","['レブロン', '・', 'ジェームズが', '、', '選手権で初めての勝利を収めたのは', '、', 'いつですか', '？']"
3053,"Who was president for a longer time, Theodore Roosevelt or Franklin D. Roosevelt?","""セオドア・ルーズベルトかフランクリン・D・ルーズベルト、どちらの大統領就任期間が長かった?""",en,ja,"['O', 'O', 'O', 'O', 'O', 'O', 'O', 'O', 'B-PERSON', 'I-PERSON', 'O', 'B-PERSON', 'I-PERSON', 'I-PERSON', 'O']","['O', 'B-PERSON', 'I-PERSON', 'I-PERSON', 'I-PERSON', 'I-PERSON', 'I-PERSON', 'I-PERSON', 'O', 'O', 'O', 'O']","['Who', 'was', 'president', 'for', 'a', 'longer', 'time', ',', 'Theodore', 'Roosevelt', 'or', 'Franklin', 'D.', 'Roosevelt', '?']","['""', 'セオドア', '・', 'ルーズベルトかフランクリン', '・', 'D', '・', 'ルーズベルト', '、', 'どちらの大統領就任期間が長かった', '?', '""']"
4990,How many of the 50 states do not use counties?,50つの州のうちで、県で地域の区分けを表示していない州はどれぐらいありますか？,en,ja,"['O', 'O', 'O', 'O', 'B-CARDINAL', 'O', 'O', 'O', 'O', 'O', 'O']","['O', 'O', 'O', 'O']","['How', 'many', 'of', 'the', '50', 'states', 'do', 'not', 'use', 'counties', '?']","['50つの州のうちで', '、', '県で地域の区分けを表示していない州はどれぐらいありますか', '？']"
