,source_text,target_text,source_lang,target_lang,source_text_ner,target_text_ner,source_text_ner_tokens,target_text_ner_tokens
1672,Which book has the most written characters in the world?,世界史上、一番多い語数の多い本はどれ？,en,ja,"['O', 'O', 'O', 'O', 'O', 'O', 'O', 'O', 'O', 'O', 'O']","['O', 'O', 'O', 'O']","['Which', 'book', 'has', 'the', 'most', 'written', 'characters', 'in', 'the', 'world', '?']","['世界史上', '、', '一番多い語数の多い本はどれ', '？']"
1882,How many states does Mexico touch?,メキシコはいくつの州に面していますか？,en,ja,"['O', 'O', 'O', 'O', 'B-GPE', 'O', 'O']","['B-GPE', 'O']","['How', 'many', 'states', 'does', 'Mexico', 'touch', '?']","['メキシコはいくつの州に面していますか', '？']"
3131,"Which Axis Power had atomic bombs dropped on it, Italy or Japan?",イタリアと日本、どちらの枢軸国が原爆を落とされた？,en,ja,"['O', 'O', 'O', 'O', 'O', 'O', 'O', 'O', 'O', 'O', 'B-GPE', 'O', 'B-GPE', 'O']","['B-GPE', 'O', 'O', 'O']","['Which', 'Axis', 'Power', 'had', 'atomic', 'bombs', 'dropped', 'on', 'it', ',', 'Italy', 'or', 'Japan', '?']","['イタリアと日本', '、', 'どちらの枢軸国が原爆を落とされた', '？']"
5828,What is a prehistoric monument located in the UK and is made up of rocks and stones?,イギリスにある先史時代のモニュメントの中で、岩や石でできているものは何ですか？,en,ja,"['O', 'O', 'O', 'O', 'O', 'O', 'O', 'O', 'B-GPE', 'O', 'O', 'O', 'O', 'O', 'O', 'O', 'O', 'O']","['B-GPE', 'O', 'O', 'O']","['What', 'is', 'a', 'prehistoric', 'monument', 'located', 'in', 'the', 'UK', 'and', 'is', 'made', 'up', 'of', 'rocks', 'and', 'stones', '?']","['イギリスにある先史時代のモニュメントの中で', '、', '岩や石でできているものは何ですか', '？']"
4004,Which movie starred Naomi Watts and was a remake of a Japanese horror movie?,日本のホラー映画のリメイクでナオミ・ワッツが出演している映画はどれですか？,en,ja,"['O', 'O', 'O', 'B-PERSON', 'I-PERSON', 'O', 'O', 'O', 'O', 'O', 'O', 'B-NORP', 'O', 'O', 'O']","['B-NORP', 'B-PERSON', 'I-PERSON', 'O']","['Which', 'movie', 'starred', 'Naomi', 'Watts', 'and', 'was', 'a', 'remake', 'of', 'a', 'Japanese', 'horror', 'movie', '?']","['日本のホラー映画のリメイクでナオミ', '・', 'ワッツが出演している映画はどれですか', '？']"
6300,What is the name of the orange ghost in Pac-Man?,パックマンのオレンジのおばけの名前は何でしょうか？,en,ja,"['O', 'O', 'O', 'O', 'O', 'O', 'O', 'O', 'O', 'B-WORK_OF_ART', 'I-WORK_OF_ART', 'I-WORK_OF_ART', 'O']","['O', 'O']","['What', 'is', 'the', 'name', 'of', 'the', 'orange', 'ghost', 'in', 'Pac', '-', 'Man', '?']","['パックマンのオレンジのおばけの名前は何でしょうか', '？']"
4979,Which 2Pac album has the most songs?,2パックのアルバムで最も多くの曲が収録されているのは何ですか？,en,ja,"['O', 'B-ORG', 'O', 'O', 'O', 'O', 'O', 'O']","['O', 'O']","['Which', '2Pac', 'album', 'has', 'the', 'most', 'songs', '?']","['2パックのアルバムで最も多くの曲が収録されているのは何ですか', '？']"
318,Where was the actress who played Harley Quinn in Birds of Prey born?,『ハーレー・クインの華麗なる覚醒』でハーレイ・クインを演じた女優の出身地はどこですか？,en,ja,"['O', 'O', 'O', 'O', 'O', 'O', 'B-PERSON', 'I-PERSON', 'O', 'B-WORK_OF_ART', 'I-WORK_OF_ART', 'I-WORK_OF_ART', 'O', 'O']","['O', 'B-WORK_OF_ART', 'I-WORK_OF_ART', 'I-WORK_OF_ART', 'I-WORK_OF_ART', 'O', 'O', 'O', 'O']","['Where', 'was', 'the', 'actress', 'who', 'played', 'Harley', 'Quinn', 'in', 'Birds', 'of', 'Prey', 'born', '?']","['『', 'ハーレー', '・', 'クインの華麗なる覚醒', '』', 'でハーレイ', '・', 'クインを演じた女優の出身地はどこですか', '？']"
6960,Which NBA player befriended several rappers who are affiliated with the Bloods and currently plays for a New York basketball team?,ブラッズと提携をしている何人かのラッパーと交友関係があり、現在ニューヨークの野球チームに所属しているNBA選手は誰？,en,ja,"['O', 'B-ORG', 'O', 'O', 'O', 'O', 'O', 'O', 'O', 'O', 'O', 'B-PERSON', 'O', 'O', 'O', 'O', 'O', 'B-GPE', 'I-GPE', 'O', 'O', 'O']","['O', 'O', 'O', 'O']","['Which', 'NBA', 'player', 'befriended', 'several', 'rappers', 'who', 'are', 'affiliated', 'with', 'the', 'Bloods', 'and', 'currently', 'plays', 'for', 'a', 'New', 'York', 'basketball', 'team', '?']","['ブラッズと提携をしている何人かのラッパーと交友関係があり', '、', '現在ニューヨークの野球チームに所属しているNBA選手は誰', '？']"
176,Which Christmas favorite movie received five nominations for an Academy Award but did not win any of them?,アカデミーの5部門にノミネートされながらどの部門でも受賞できなかった、クリスマスに好まれる映画はどれですか？,en,ja,"['O', 'B-DATE', 'O', 'O', 'O', 'B-CARDINAL', 'O', 'O', 'O', 'B-WORK_OF_ART', 'I-WORK_OF_ART', 'O', 'O', 'O', 'O', 'O', 'O', 'O', 'O']","['O', 'O', 'O', 'O']","['Which', 'Christmas', 'favorite', 'movie', 'received', 'five', 'nominations', 'for', 'an', 'Academy', 'Award', 'but', 'did', 'not', 'win', 'any', 'of', 'them', '?']","['アカデミーの5部門にノミネートされながらどの部門でも受賞できなかった', '、', 'クリスマスに好まれる映画はどれですか', '？']"
1383,"Which book was published first, Twilight or Harry Potter and the Sorcerer's Stone?","""トワイライトとハリーポッターと賢者の石ではどちらが先に出版されましたか？""",en,ja,"['O', 'O', 'O', 'O', 'B-ORDINAL', 'O', 'B-WORK_OF_ART', 'O', 'B-WORK_OF_ART', 'I-WORK_OF_ART', 'I-WORK_OF_ART', 'I-WORK_OF_ART', 'I-WORK_OF_ART', 'I-WORK_OF_ART', 'O']","['O', 'O', 'O', 'O']","['Which', 'book', 'was', 'published', 'first', ',', 'Twilight', 'or', 'Harry', 'Potter', 'and', 'the', ""Sorcerer's"", 'Stone', '?']","['""', 'トワイライトとハリーポッターと賢者の石ではどちらが先に出版されましたか', '？', '""']"
2673,Who is a current senator of Utah and a former governor of Massachusetts?,ユタ州の現上院議員で、前マサチューセッツ州知事だったのは誰?,en,ja,"['O', 'O', 'O', 'O', 'O', 'O', 'B-GPE', 'O', 'O', 'O', 'O', 'O', 'B-GPE', 'O']","['B-GPE', 'O', 'O', 'O']","['Who', 'is', 'a', 'current', 'senator', 'of', 'Utah', 'and', 'a', 'former', 'governor', 'of', 'Massachusetts', '?']","['ユタ州の現上院議員で', '、', '前マサチューセッツ州知事だったのは誰', '?']"
2807,How old is the oldest state governor in the USA?,アメリカ合衆国で最年長の州知事は何歳ですか？,en,ja,"['O', 'O', 'O', 'O', 'O', 'O', 'O', 'O', 'O', 'B-GPE', 'O']","['O', 'O']","['How', 'old', 'is', 'the', 'oldest', 'state', 'governor', 'in', 'the', 'USA', '?']","['アメリカ合衆国で最年長の州知事は何歳ですか', '？']"
1820,"Which country has a higher population, Greenland or Iceland?","""グリーンランドとアイスランドとで、人口が多いのはどちらの国ですか？""",en,ja,"['O', 'O', 'O', 'O', 'O', 'O', 'O', 'B-GPE', 'O', 'B-GPE', 'O']","['O', 'B-GPE', 'O', 'O', 'O', 'O']","['Which', 'country', 'has', 'a', 'higher', 'population', ',', 'Greenland', 'or', 'Iceland', '?']","['""', 'グリーンランドとアイスランドとで', '、', '人口が多いのはどちらの国ですか', '？', '""']"
3269,How many countries did the USSR dissolve into when it collapsed?,ソビエト連邦が崩壊した時、いくつの国に解体されましたか?,en,ja,"['O', 'O', 'O', 'O', 'O', 'B-GPE', 'O', 'O', 'O', 'O', 'O', 'O']","['B-GPE', 'O', 'O', 'O']","['How', 'many', 'countries', 'did', 'the', 'USSR', 'dissolve', 'into', 'when', 'it', 'collapsed', '?']","['ソビエト連邦が崩壊した時', '、', 'いくつの国に解体されましたか', '?']"
6896,Did the Renaissance affect the studies of ornithology following the early 1500s?,1500年代に続き、ルネッサンスは鳥類学に影響を与えましたか？,en,ja,"['O', 'B-DATE', 'I-DATE', 'O', 'O', 'O', 'O', 'O', 'O', 'B-DATE', 'I-DATE', 'I-DATE', 'I-DATE', 'O']","['B-DATE', 'I-DATE', 'O', 'O', 'O']","['Did', 'the', 'Renaissance', 'affect', 'the', 'studies', 'of', 'ornithology', 'following', 'the', 'early', '1500', 's', '?']","['1500', '年代に続き', '、', 'ルネッサンスは鳥類学に影響を与えましたか', '？']"
6683,"Which state has more electoral votes, California or Delaware?","""カリフォルニア州とデラウェア州のどちらの州の方が、選挙人の票が多いですか?""",en,ja,"['O', 'O', 'O', 'O', 'O', 'O', 'O', 'B-GPE', 'O', 'B-GPE', 'O']","['O', 'O', 'O', 'O', 'O', 'O']","['Which', 'state', 'has', 'more', 'electoral', 'votes', ',', 'California', 'or', 'Delaware', '?']","['""', 'カリフォルニア州とデラウェア州のどちらの州の方が', '、', '選挙人の票が多いですか', '?', '""']"
91,How many Academy Awards has Clint Eastwood won for Best Director?,クリント・イーストウッドは、何度アカデミー監督賞を受賞しましたか？,en,ja,"['O', 'O', 'B-WORK_OF_ART', 'I-WORK_OF_ART', 'O', 'B-PERSON', 'I-PERSON', 'O', 'O', 'O', 'O', 'O']","['B-PERSON', 'I-PERSON', 'I-PERSON', 'O', 'O', 'O']","['How', 'many', 'Academy', 'Awards', 'has', 'Clint', 'Eastwood', 'won', 'for', 'Best', 'Director', '?']","['クリント', '・', 'イーストウッドは', '、', '何度アカデミー監督賞を受賞しましたか', '？']"
4080,What is the oldest movie ever shown on television?,テレビで放映されたことのある最も古い映画は?,en,ja,"['O', 'O', 'O', 'O', 'O', 'O', 'O', 'O', 'O', 'O']","['O', 'O']","['What', 'is', 'the', 'oldest', 'movie', 'ever', 'shown', 'on', 'television', '?']","['テレビで放映されたことのある最も古い映画は', '?']"
1144,Who was the pitcher of the team that won the 2017 World Series?,2017年のワールドシリーズ優勝チームのピッチャーは誰でしたか？,en,ja,"['O', 'O', 'O', 'O', 'O', 'O', 'O', 'O', 'O', 'O', 'B-DATE', 'B-EVENT', 'I-EVENT', 'O']","['B-DATE', 'O', 'O']","['Who', 'was', 'the', 'pitcher', 'of', 'the', 'team', 'that', 'won', 'the', '2017', 'World', 'Series', '?']","['2017', '年のワールドシリーズ優勝チームのピッチャーは誰でしたか', '？']"
6214,Who was the emperor of Rome when it fell?,ローマ帝国が滅亡したときの皇帝は誰でしたか？,en,ja,"['O', 'O', 'O', 'O', 'O', 'O', 'O', 'O', 'O', 'O']","['O', 'O']","['Who', 'was', 'the', 'emperor', 'of', 'Rome', 'when', 'it', 'fell', '?']","['ローマ帝国が滅亡したときの皇帝は誰でしたか', '？']"
3080,"Which American Civil War battle occurred later, Battle of Gettysburg or Battle of Nashville?","""アメリカの南北戦争で後に起こったのは、ゲティスバーグの戦いかナッシュビルの戦いのどっち?""",en,ja,"['O', 'B-EVENT', 'I-EVENT', 'I-EVENT', 'O', 'O', 'O', 'O', 'B-EVENT', 'I-EVENT', 'I-EVENT', 'O', 'B-EVENT', 'I-EVENT', 'I-EVENT', 'O']","['O', 'B-GPE', 'O', 'O', 'O', 'O']","['Which', 'American', 'Civil', 'War', 'battle', 'occurred', 'later', ',', 'Battle', 'of', 'Gettysburg', 'or', 'Battle', 'of', 'Nashville', '?']","['""', 'アメリカの南北戦争で後に起こったのは', '、', 'ゲティスバーグの戦いかナッシュビルの戦いのどっち', '?', '""']"
2955,Which game in Assassin's Creed takes place in the time of Ancient Egypt?,Assasins Creedのどのゲームが古代エジプト期を舞台にしているの?,en,ja,"['O', 'O', 'O', 'B-WORK_OF_ART', 'I-WORK_OF_ART', 'O', 'O', 'O', 'O', 'O', 'O', 'O', 'O', 'O']","['O', 'O', 'O']","['Which', 'game', 'in', ""Assassin's"", 'Creed', 'takes', 'place', 'in', 'the', 'time', 'of', 'Ancient', 'Egypt', '?']","['Assasins', 'Creedのどのゲームが古代エジプト期を舞台にしているの', '?']"
5957,Who is the junior senator from Vermont?,バーモント州の若手議員は誰？,en,ja,"['O', 'O', 'O', 'O', 'O', 'O', 'B-GPE', 'O']","['B-GPE', 'O']","['Who', 'is', 'the', 'junior', 'senator', 'from', 'Vermont', '?']","['バーモント州の若手議員は誰', '？']"
1244,Who is the youngest player to win a Super Bowl?,スーパーボウルで勝った最年少のプレイヤーは誰ですか？,en,ja,"['O', 'O', 'O', 'O', 'O', 'O', 'O', 'B-EVENT', 'I-EVENT', 'I-EVENT', 'O']","['O', 'O']","['Who', 'is', 'the', 'youngest', 'player', 'to', 'win', 'a', 'Super', 'Bowl', '?']","['スーパーボウルで勝った最年少のプレイヤーは誰ですか', '？']"
6915,What movie came out in 2018 and starred Malin Åkerman?,マリン・アッカーマンが出演した2018年公開の映画はどれですか？,en,ja,"['O', 'O', 'O', 'O', 'O', 'B-DATE', 'O', 'O', 'B-PERSON', 'I-PERSON', 'O']","['B-PERSON', 'I-PERSON', 'O', 'O']","['What', 'movie', 'came', 'out', 'in', '2018', 'and', 'starred', 'Malin', 'Åkerman', '?']","['マリン', '・', 'アッカーマンが出演した2018年公開の映画はどれですか', '？']"
2208,What is the second largest rainforest in the world?,世界の二番目に大きな熱帯雨林は何ですか？,en,ja,"['O', 'O', 'O', 'B-ORDINAL', 'O', 'O', 'O', 'O', 'O', 'O']","['O', 'O']","['What', 'is', 'the', 'second', 'largest', 'rainforest', 'in', 'the', 'world', '?']","['世界の二番目に大きな熱帯雨林は何ですか', '？']"
4464,What is the longest book ever written?,今までに書いた一番長い本は何ですか？,en,ja,"['O', 'O', 'O', 'O', 'O', 'O', 'O', 'O']","['O', 'O']","['What', 'is', 'the', 'longest', 'book', 'ever', 'written', '?']","['今までに書いた一番長い本は何ですか', '？']"
2486,Did the United States of America ever have a female vice president before 2021?,2021年より前にアメリカ合衆国は女性大統領が就任したことがある?,en,ja,"['O', 'B-GPE', 'I-GPE', 'I-GPE', 'I-GPE', 'I-GPE', 'O', 'O', 'O', 'O', 'O', 'O', 'O', 'B-DATE', 'O']","['B-DATE', 'O', 'O']","['Did', 'the', 'United', 'States', 'of', 'America', 'ever', 'have', 'a', 'female', 'vice', 'president', 'before', '2021', '?']","['2021', '年より前にアメリカ合衆国は女性大統領が就任したことがある', '?']"
2629,"What southwestern state did Donald Trump win in 2016, but did not win in 2020?",2016年にドナルド・トランプに投票したが、2020年にはドナルド・トランプに投票しなかった南西部の州はどこ？,en,ja,"['O', 'O', 'O', 'O', 'B-PERSON', 'I-PERSON', 'O', 'O', 'B-DATE', 'O', 'O', 'O', 'O', 'O', 'O', 'B-DATE', 'O']","['B-DATE', 'I-DATE', 'B-PERSON', 'I-PERSON', 'O', 'B-DATE', 'I-DATE', 'B-PERSON', 'I-PERSON', 'O']","['What', 'southwestern', 'state', 'did', 'Donald', 'Trump', 'win', 'in', '2016', ',', 'but', 'did', 'not', 'win', 'in', '2020', '?']","['2016', '年にドナルド', '・', 'トランプに投票したが', '、', '2020', '年にはドナルド', '・', 'トランプに投票しなかった南西部の州はどこ', '？']"
3720,Who was pope the longest?,ローマ教皇で最も在位期間が長いのは?,en,ja,"['O', 'O', 'O', 'O', 'O', 'O']","['O', 'O']","['Who', 'was', 'pope', 'the', 'longest', '?']","['ローマ教皇で最も在位期間が長いのは', '?']"
2168,What is the tallest building in the capital city of Germany?,ドイツの首都で最も高い建物は？,en,ja,"['O', 'O', 'O', 'O', 'O', 'O', 'O', 'O', 'O', 'O', 'B-GPE', 'O']","['B-GPE', 'O']","['What', 'is', 'the', 'tallest', 'building', 'in', 'the', 'capital', 'city', 'of', 'Germany', '?']","['ドイツの首都で最も高い建物は', '？']"
106,How many Academy Awards has Alicia Vikander won?,アリシア・ヴィキャンデルはいくつのアカデミー賞を受賞しているでしょう?,en,ja,"['O', 'O', 'B-WORK_OF_ART', 'I-WORK_OF_ART', 'O', 'B-PERSON', 'I-PERSON', 'O', 'O']","['O', 'O', 'O', 'O']","['How', 'many', 'Academy', 'Awards', 'has', 'Alicia', 'Vikander', 'won', '?']","['アリシア', '・', 'ヴィキャンデルはいくつのアカデミー賞を受賞しているでしょう', '?']"
6162,Who was the last ruler of the Hawaiian Kingdom?,ハワイ王国の最後の国王は誰ですか？,en,ja,"['O', 'O', 'O', 'O', 'O', 'O', 'B-GPE', 'I-GPE', 'I-GPE', 'O']","['O', 'O']","['Who', 'was', 'the', 'last', 'ruler', 'of', 'the', 'Hawaiian', 'Kingdom', '?']","['ハワイ王国の最後の国王は誰ですか', '？']"
2726,Who is the current wife of the current prime minister of the United Kingdom?,イギリスの現首相の現在の奥さんは誰ですか？,en,ja,"['O', 'O', 'O', 'O', 'O', 'O', 'O', 'O', 'O', 'O', 'O', 'B-GPE', 'I-GPE', 'I-GPE', 'O']","['O', 'O']","['Who', 'is', 'the', 'current', 'wife', 'of', 'the', 'current', 'prime', 'minister', 'of', 'the', 'United', 'Kingdom', '?']","['イギリスの現首相の現在の奥さんは誰ですか', '？']"
3034,Is Doctor Neo Cortex the nemesis of Crash Bandicoot?,クラッシュバンディクーの宿敵はネオ・コルテックス?,en,ja,"['O', 'O', 'B-PERSON', 'I-PERSON', 'O', 'O', 'O', 'B-PRODUCT', 'I-PRODUCT', 'O']","['O', 'O', 'O', 'O']","['Is', 'Doctor', 'Neo', 'Cortex', 'the', 'nemesis', 'of', 'Crash', 'Bandicoot', '?']","['クラッシュバンディクーの宿敵はネオ', '・', 'コルテックス', '?']"
6698,"Since 1991, which governors of Florida have not been Republican?",1991年以降のフロリダ州知事で共和党でないのは誰？,en,ja,"['O', 'B-DATE', 'O', 'O', 'O', 'O', 'B-GPE', 'O', 'O', 'O', 'B-NORP', 'O']","['B-DATE', 'O', 'O']","['Since', '1991', ',', 'which', 'governors', 'of', 'Florida', 'have', 'not', 'been', 'Republican', '?']","['1991', '年以降のフロリダ州知事で共和党でないのは誰', '？']"
3409,Who became Pope of the Catholic Church and is also from Latin America?,カトリック教会のローマ教皇となり、ラテンアメリカ出身でもあるのは?,en,ja,"['O', 'O', 'B-PERSON', 'O', 'B-ORG', 'I-ORG', 'I-ORG', 'O', 'O', 'O', 'O', 'B-LOC', 'I-LOC', 'O']","['B-ORG', 'O', 'B-GPE', 'O']","['Who', 'became', 'Pope', 'of', 'the', 'Catholic', 'Church', 'and', 'is', 'also', 'from', 'Latin', 'America', '?']","['カトリック教会のローマ教皇となり', '、', 'ラテンアメリカ出身でもあるのは', '?']"
2124,How many people live in the capital of Oregon?,オレゴンの州都の人口は？,en,ja,"['O', 'O', 'O', 'O', 'O', 'O', 'O', 'O', 'B-GPE', 'O']","['B-GPE', 'O']","['How', 'many', 'people', 'live', 'in', 'the', 'capital', 'of', 'Oregon', '?']","['オレゴンの州都の人口は', '？']"
4002,What movie starred Leonardo DiCaprio and was directed by James Cameron?,レオナルド・ディカプリオ主演でジェームズ・キャメロン監督の映画は何？,en,ja,"['O', 'O', 'O', 'B-PERSON', 'I-PERSON', 'O', 'O', 'O', 'O', 'B-PERSON', 'I-PERSON', 'O']","['B-PERSON', 'I-PERSON', 'I-PERSON', 'I-PERSON', 'I-PERSON', 'O']","['What', 'movie', 'starred', 'Leonardo', 'DiCaprio', 'and', 'was', 'directed', 'by', 'James', 'Cameron', '?']","['レオナルド', '・', 'ディカプリオ主演でジェームズ', '・', 'キャメロン監督の映画は何', '？']"
676,Which member of Bruce Springsteen's E Street Band died from a stroke?,ブルース・スプリングスティーンのEストリートバンドのメンバーで、脳卒中で亡くなったのは誰ですか？,en,ja,"['O', 'O', 'O', 'B-PERSON', 'I-PERSON', 'B-ORG', 'I-ORG', 'I-ORG', 'O', 'O', 'O', 'O', 'O']","['B-PERSON', 'O', 'O', 'O', 'O', 'O']","['Which', 'member', 'of', 'Bruce', ""Springsteen's"", 'E', 'Street', 'Band', 'died', 'from', 'a', 'stroke', '?']","['ブルース', '・', 'スプリングスティーンのEストリートバンドのメンバーで', '、', '脳卒中で亡くなったのは誰ですか', '？']"
7143,What city is called the Big Apple?,ビッグ・アップルと呼ばれる都市はどこですか？,en,ja,"['O', 'O', 'O', 'O', 'O', 'O', 'O', 'O']","['O', 'O', 'O', 'O']","['What', 'city', 'is', 'called', 'the', 'Big', 'Apple', '?']","['ビッグ', '・', 'アップルと呼ばれる都市はどこですか', '？']"
3464,Which World War II general was also a United States president?,第2次世界大戦時の将軍で、アメリカ大統領だったのは?,en,ja,"['O', 'B-EVENT', 'I-EVENT', 'I-EVENT', 'O', 'O', 'O', 'O', 'B-GPE', 'I-GPE', 'O', 'O']","['B-EVENT', 'O', 'B-GPE', 'O']","['Which', 'World', 'War', 'II', 'general', 'was', 'also', 'a', 'United', 'States', 'president', '?']","['第2次世界大戦時の将軍で', '、', 'アメリカ大統領だったのは', '?']"
5274,"In the1994 movie The Shawshank Redemption, one of the lead male roles was played by?",1994年の『ショーシャンクの空に』で主役は誰に演じられましたか？,en,ja,"['O', 'O', 'O', 'B-WORK_OF_ART', 'I-WORK_OF_ART', 'I-WORK_OF_ART', 'O', 'B-CARDINAL', 'O', 'O', 'O', 'O', 'O', 'O', 'O', 'O', 'O']","['B-DATE', 'I-DATE', 'O', 'B-WORK_OF_ART', 'I-WORK_OF_ART', 'O', 'O']","['In', 'the1994', 'movie', 'The', 'Shawshank', 'Redemption', ',', 'one', 'of', 'the', 'lead', 'male', 'roles', 'was', 'played', 'by', '?']","['1994', '年の', '『', 'ショーシャンクの空に', '』', 'で主役は誰に演じられましたか', '？']"
4252,What Super Bowls did Russell Wilson play in but not win?,ラッセル・ウィルソンが出場して勝てなかったスーパーボウルはどれですか？,en,ja,"['O', 'B-EVENT', 'I-EVENT', 'O', 'B-PERSON', 'I-PERSON', 'O', 'O', 'O', 'O', 'O', 'O']","['B-PERSON', 'I-PERSON', 'O', 'O']","['What', 'Super', 'Bowls', 'did', 'Russell', 'Wilson', 'play', 'in', 'but', 'not', 'win', '?']","['ラッセル', '・', 'ウィルソンが出場して勝てなかったスーパーボウルはどれですか', '？']"
544,"Which was the better selling Rolling Stones album, Aftermath or Beggars Banquet?","""アフターマースかべがース・バンケットかどちらがロリング・ストーンのアルバムの売りこと方がいいですか？""",en,ja,"['O', 'O', 'O', 'O', 'O', 'B-ORG', 'I-ORG', 'O', 'O', 'B-WORK_OF_ART', 'I-WORK_OF_ART', 'I-WORK_OF_ART', 'I-WORK_OF_ART', 'O']","['O', 'O', 'O', 'O', 'O', 'O', 'O', 'O']","['Which', 'was', 'the', 'better', 'selling', 'Rolling', 'Stones', 'album', ',', 'Aftermath', 'or', 'Beggars', 'Banquet', '?']","['""', 'アフターマースかべがース', '・', 'バンケットかどちらがロリング', '・', 'ストーンのアルバムの売りこと方がいいですか', '？', '""']"
472,Was Harrison Ford in A New Hope?,ハリソン・フォードは新たなる希望に出演してますか?,en,ja,"['O', 'B-PERSON', 'I-PERSON', 'O', 'B-WORK_OF_ART', 'I-WORK_OF_ART', 'I-WORK_OF_ART', 'O']","['B-PERSON', 'I-PERSON', 'I-PERSON', 'O']","['Was', 'Harrison', 'Ford', 'in', 'A', 'New', 'Hope', '?']","['ハリソン', '・', 'フォードは新たなる希望に出演してますか', '?']"
4845,Who was the first sitting senator to be elected president of the United States?,アメリカ合衆国の大統領に選出された最初の現職上院議員は誰ですか？,en,ja,"['O', 'O', 'O', 'B-ORDINAL', 'O', 'O', 'O', 'O', 'O', 'O', 'O', 'B-GPE', 'I-GPE', 'I-GPE', 'O']","['O', 'O']","['Who', 'was', 'the', 'first', 'sitting', 'senator', 'to', 'be', 'elected', 'president', 'of', 'the', 'United', 'States', '?']","['アメリカ合衆国の大統領に選出された最初の現職上院議員は誰ですか', '？']"
1009,Which international final did Lionel Messi not lose with Argentina?,リオネル・メッシがアルゼンチンチームでプレーして勝った決勝戦は、何の世界大会？,en,ja,"['O', 'O', 'O', 'O', 'B-PERSON', 'I-PERSON', 'O', 'O', 'O', 'B-GPE', 'O']","['B-PERSON', 'O', 'O', 'O', 'O', 'O']","['Which', 'international', 'final', 'did', 'Lionel', 'Messi', 'not', 'lose', 'with', 'Argentina', '?']","['リオネル', '・', 'メッシがアルゼンチンチームでプレーして勝った決勝戦は', '、', '何の世界大会', '？']"
2057,What river flows through Russia and is the longest river in Europe?,ヨーロッパで最も長く、ロシアを流れる川の名前は何ですか？,en,ja,"['O', 'O', 'O', 'O', 'B-GPE', 'O', 'O', 'O', 'O', 'O', 'O', 'B-LOC', 'O']","['B-LOC', 'O', 'B-GPE', 'O']","['What', 'river', 'flows', 'through', 'Russia', 'and', 'is', 'the', 'longest', 'river', 'in', 'Europe', '?']","['ヨーロッパで最も長く', '、', 'ロシアを流れる川の名前は何ですか', '？']"
5632,What was the name of the Elven archer in Lord of the Rings?,『ロード・オブ・ザ・リング』に登場するエルフの弓の射手は何という名前ですか？,en,ja,"['O', 'O', 'O', 'O', 'O', 'O', 'B-NORP', 'O', 'O', 'B-WORK_OF_ART', 'I-WORK_OF_ART', 'I-WORK_OF_ART', 'I-WORK_OF_ART', 'O']","['O', 'B-WORK_OF_ART', 'I-WORK_OF_ART', 'I-WORK_OF_ART', 'I-WORK_OF_ART', 'I-WORK_OF_ART', 'I-WORK_OF_ART', 'I-WORK_OF_ART', 'I-WORK_OF_ART', 'O', 'O']","['What', 'was', 'the', 'name', 'of', 'the', 'Elven', 'archer', 'in', 'Lord', 'of', 'the', 'Rings', '?']","['『', 'ロード', '・', 'オブ', '・', 'ザ', '・', 'リング', '』', 'に登場するエルフの弓の射手は何という名前ですか', '？']"
